{
  "contract_version": "review-output.v1",
  "run_id": "11111111-1111-4111-8111-111111111111",
  "summary": "Найдено одно уточнение по расписанию обновления.",
  "coverage": {
    "reviewed_fragment_ids": [
      "source-main-lines-1-3"
    ],
    "unreviewed": [],
    "source_gaps": [
      {
        "source_id": "source-context",
        "fragment_id": null,
        "code": "source_unavailable",
        "reason": "Синтетический источник контекста недоступен в снимке запуска."
      }
    ]
  },
  "findings": [
    {
      "local_id": "F-001",
      "kind": "ambiguity",
      "title": "Не задано расписание обновления",
      "problem": "Термин «регулярно» не задаёт момент и период запуска.",
      "reason": "Разработчик и тестировщик не могут однозначно реализовать и проверить регламент.",
      "question": "С какой периодичностью, в какое время и в каком часовом поясе запускать обновление?",
      "priority": {
        "level": "high",
        "rationale": "Расписание влияет на доступность и проверяемость данных."
      },
      "anchors": [
        {
          "source_id": "source-main",
          "fragment_id": "source-main-lines-1-3",
          "quote": "Обновление витрины выполняется регулярно.",
          "quote_start": 0,
          "quote_end": 41
        }
      ],
      "scope": []
    }
  ],
  "limitations": [
    "Проверка выполнена без недоступного источника контекста.",
    "Синтетический пример не является экспертной оценкой."
  ]
}
